{
  "meta": {
    "title": "Agent Zero · his concepts + the fleet",
    "description": "The bet, his words by date, 11 projects, the 51-module register by host, decisions, the fleet now, gaps.",
    "stream": "agents",
    "crumb": [
      {
        "label": "Templates",
        "href": "/"
      },
      {
        "label": "U9 · Agent Zero",
        "href": "/t/U9/"
      },
      {
        "label": "example"
      }
    ],
    "actions": [
      {
        "label": "issues",
        "href": "https://github.com/sisodias/siso-agent-zero-protocol/issues",
        "icon": "list-todo",
        "external": true
      },
      {
        "label": "atlas (laptop)",
        "href": "http://127.0.0.1:8890/atlas/",
        "icon": "map",
        "external": true
      }
    ],
    "source": "00_AGENT_ZERO: INTENT.md · plan/{modules,projects,decisions}.json · source/ (49 files, 114,113 words) · ledger/OWNERS.md · atlas/now.json 19:34"
  },
  "heading": {
    "breadcrumb": [
      {
        "label": "Agents",
        "href": "https://great-library-of-siso.pages.dev/agents/"
      },
      {
        "label": "Agent Zero"
      }
    ],
    "kicker": "agent_system <span class=\"sep\">·</span> the head <span class=\"sep\">·</span> <span class=\"dim\">sisodias/siso-agent-zero-protocol · private</span>",
    "title": "Agent Zero",
    "subtitle": "The bet: give every small and medium business the operating system only the biggest companies can afford today, by being the best in the world at turning open-source code and the best available intelligence into working systems. Deadline 31 December 2029. <span class=\"faint\">(INTENT.md, his memos compressed, not yet ratified)</span>",
    "badges": [
      {
        "label": "agents",
        "tone": "agents"
      },
      {
        "label": "register · 7 landed · 24 partial · 20 untouched",
        "tone": "warn",
        "href": "#register"
      },
      {
        "label": "11 projects",
        "tone": "projects",
        "href": "#projects"
      },
      {
        "label": "22 God Questions",
        "tone": "research",
        "href": "/t/U5/"
      },
      {
        "label": "44 decisions + 9 from this seat",
        "tone": "agents",
        "href": "#decisions"
      },
      {
        "label": "49 source files · 114,113 words",
        "tone": "clients",
        "href": "#concepts"
      }
    ],
    "status": {
      "kicker": "Now · atlas/now.json",
      "value": "AGENT-ZERO done · TEMPLATE-BANK-ZERO working",
      "note": "Read 6 Sep 19:34 UTC+07 from Herdr. Live view stays on the laptop atlas; this page is the Library's mirror.",
      "facts": [
        {
          "k": "head repo",
          "v": "<code>18ea54d</code> · 6 Sep 18:48"
        },
        {
          "k": "harness-lab",
          "v": "<code>fb05217</code> · 6 Sep 15:11"
        },
        {
          "k": "front door",
          "v": "atlas (laptop only) · agent-zero.pages.dev not yet"
        }
      ]
    },
    "metrics": [
      {
        "value": 11,
        "label": "projects",
        "tone": "projects",
        "href": "#projects"
      },
      {
        "value": 8,
        "label": "source captures",
        "tone": "agents",
        "href": "#concepts"
      },
      {
        "value": 6,
        "label": "decisions",
        "tone": "agents",
        "href": "#decisions"
      },
      {
        "value": 8,
        "label": "register rows",
        "tone": "muted",
        "href": "#register"
      }
    ],
    "jump": [
      {
        "label": "The bet and the two axes",
        "href": "#bet"
      },
      {
        "label": "Counts",
        "href": "#counts"
      },
      {
        "label": "His concepts, in his words",
        "href": "#concepts"
      },
      {
        "label": "Projects",
        "href": "#projects"
      },
      {
        "label": "The register",
        "href": "#register"
      },
      {
        "label": "Decisions",
        "href": "#decisions"
      }
    ]
  },
  "sections": {
    "bet": {
      "n": "01",
      "title": "The bet and the two axes",
      "sub": "INTENT.md is the fixed part; agency work and client work are the axes (his 5 Sep 22:20)"
    },
    "counts": {
      "n": "02",
      "title": "Counts",
      "sub": "every number from a JSON in the repo"
    },
    "concepts": {
      "n": "03",
      "title": "His concepts, in his words",
      "sub": "source/ · verbatim · dated · what each caused"
    },
    "projects": {
      "n": "04",
      "title": "Projects",
      "sub": "plan/projects.json · 11 rows · each a U4 one pager"
    },
    "register": {
      "n": "05",
      "title": "The register",
      "sub": "51 compute modules · allocated / not allocated / done · by host · each with its verification line"
    },
    "decisions": {
      "n": "06",
      "title": "Decisions",
      "sub": "he said 'you just decide all of the answers for me'; a decision he dislikes he reverses by saying so"
    },
    "fleet": {
      "n": "07",
      "title": "Fleet now",
      "sub": "who is live, where (atlas/now.json)"
    },
    "map": {
      "n": "08",
      "title": "Mind map",
      "sub": "projects · questions · plays · nodes"
    },
    "timeline": {
      "n": "09",
      "title": "Timeline",
      "sub": "decisions · seats · readings · his words, 5–6 Sep"
    },
    "gaps": {
      "n": "10",
      "title": "Gaps",
      "sub": "closed = fact with receipt; open = proposal"
    },
    "agent": {
      "n": "11",
      "title": "Agent entry"
    }
  },
  "reasoning": {
    "source": [
      {
        "text": "the template for Agent Zero and like a repo of all of my main concepts and information for Agent Zero. So if I want to see that front end and see what's going on with Agent Zero, see all of the main projects and all of that stuff linked to it, it's all there.",
        "who": "Shaan → AGENT-ZERO",
        "at": "6 Sep 16:36"
      },
      {
        "text": "You've got client projects and you've got agency work. It should be split like that.",
        "who": "Shaan → Fable FA0",
        "at": "5 Sep 22:20"
      }
    ],
    "why": "Never sell the company, never take outside investment; extract 20% as clean profit, reinvest 80% perpetually; no employees, ever. Three bets: intelligence keeps improving, GitHub keeps improving, industries share an operating-system shape. The flywheel is the comp bank, the repo map, the industry data and the frameworks that grow them, collected perpetually on the always-on node. <span class=\"faint\">(INTENT.md, compression of memos 1–7)</span>",
    "readers": "Human: what is the bet, who is doing what, what did I decide. Agent: INTENT → BASELINE → this page, then the project's U4.",
    "questions": [
      "What is the bet and the two axes?",
      "What are his concepts, in his words, by date?",
      "Which projects exist and what state are they in?",
      "What is allocated, done, unallocated, by host?",
      "What was decided and what reverses it?",
      "Who is running now and where?"
    ],
    "claim_ceiling": "Every number from a JSON in this repo; his words only from source/; 'landed' only with a commit or URL.",
    "data": "INTENT.md · BASELINE.md · plan/*.json · GOD-QUESTIONS.md · source/ · ledger/OWNERS.md · atlas/now.json.",
    "privacy": "Public page; the repo stays private (source/ may move to siso-agent-zero-source).",
    "empty_state": "—",
    "agent_entry": "INTENT.md → BASELINE.md → this page → <project>/.agents/PAGE.md"
  },
  "loop": [
    {
      "label": "Clients fund compute",
      "what": "ofm (Oracle, HALO) · bykonz · actionmodel",
      "href": "/t/U15/",
      "tone": "clients"
    },
    {
      "label": "Owners build",
      "what": "one seat per project, ephemeral; the projects are forever",
      "href": "/t/U17/",
      "tone": "agents"
    },
    {
      "label": "Packs enter the Library",
      "what": "47 Works · 86 Releases · 40 Snapshots",
      "href": "https://great-library-of-siso.pages.dev/",
      "tone": "projects"
    },
    {
      "label": "People + repos feed Foundry",
      "what": "17 industries · 27 repos · 9,636-repo universe",
      "href": "/t/U3/example/",
      "tone": "clients"
    },
    {
      "label": "Questions turn evidence into breakthroughs",
      "what": "22 God Questions · compute runs with receipts",
      "href": "/t/U5/example/",
      "tone": "research",
      "measured": "J2 · 1.00× · n=1"
    },
    {
      "label": "Better client outcomes",
      "what": "framework replicated industry by industry",
      "href": "/t/U8/",
      "tone": "now"
    }
  ],
  "metrics": [
    {
      "value": 11,
      "label": "projects (7 agency · 4 client)",
      "tone": "projects",
      "href": "#projects"
    },
    {
      "value": 51,
      "label": "modules in the register",
      "tone": "agents",
      "href": "#register"
    },
    {
      "value": 7,
      "label": "landed (ok)",
      "tone": "now",
      "href": "#register"
    },
    {
      "value": 24,
      "label": "partial (wf)",
      "tone": "warn",
      "href": "#register"
    },
    {
      "value": 20,
      "label": "untouched (no)",
      "tone": "blocked",
      "href": "#register"
    },
    {
      "value": 22,
      "label": "God Questions",
      "tone": "research",
      "href": "/t/U5/example/"
    },
    {
      "value": 44,
      "label": "decisions D-1…D-35 + REG/MINI/AZ",
      "tone": "agents",
      "href": "#decisions"
    },
    {
      "value": 49,
      "label": "source files · 114,113 words",
      "tone": "clients",
      "href": "#concepts"
    },
    {
      "value": 25,
      "label": "atlas pages",
      "tone": "muted",
      "href": "http://127.0.0.1:8890/atlas/"
    },
    {
      "value": 24,
      "label": "template issues #41–#64",
      "tone": "muted",
      "href": "https://github.com/sisodias/siso-agent-zero-protocol/issues?q=label%3Atemplate"
    }
  ],
  "words": [
    {